{
  "schemaVersion": 1,
  "apiVersion": 1,
  "id": "com.example.nora.hello",
  "name": "Hello Nora",
  "version": "0.1.0",
  "summary": "A native SwiftUI panel and an Echo command.",
  "publisher": "Example Publisher",
  "extensionBundleIdentifier": "com.example.nora.hello.extension",
  "permissions": [],
  "panels": [
    {
      "id": "com.example.nora.hello.panel",
      "title": "Hello Nora",
      "systemImage": "puzzlepiece.extension"
    }
  ],
  "commands": [
    {
      "id": "com.example.nora.hello.echo",
      "title": "Echo",
      "description": "Returns the supplied text.",
      "inputSchemaJSON": "{\"type\":\"object\",\"properties\":{\"text\":{\"type\":\"string\"}},\"required\":[\"text\"],\"additionalProperties\":false}",
      "readOnly": true
    }
  ]
}
